id,var,desc,macro_class
D15,ListingKey,"Unique key for each listing, same value as the 'key' used in the listing object in the API.",OPERATIONAL
D15,ListingNumber,The number that uniquely identifies the listing to the public as displayed on the website.,OPERATIONAL
D15,ListingCreationDate,The date the listing was created.,OPERATIONAL
D15,CreditGrade,The Credit rating that was assigned at the time the listing went live. Applicable for listings pre-2009 period and will only be populated for those listings.,INSTITUTIONAL and FINANCIAL
D15,Term,The length of the loan expressed in months.,INSTITUTIONAL and FINANCIAL
D15,LoanStatus,"The current status of the loan: Cancelled, Chargedoff, Completed, Current, Defaulted, FinalPaymentInProgress, PastDue. The PastDue status will be accompanied by a delinquency bucket.",INSTITUTIONAL and FINANCIAL
D15,ClosedDate,"Closed date is applicable for Cancelled, Completed, Chargedoff and Defaulted loan statuses.",OPERATIONAL
D15,BorrowerAPR,The Borrower's Annual Percentage Rate (APR) for the loan.,INSTITUTIONAL and FINANCIAL
D15,BorrowerRate,The Borrower's interest rate for this loan.,INSTITUTIONAL and FINANCIAL
D15,LenderYield,The Lender yield on the loan. Lender yield is equal to the interest rate on the loan less the servicing fee.,INSTITUTIONAL and FINANCIAL
D15,EstimatedEffectiveYield,"Effective yield is equal to the borrower interest rate (i) minus the servicing fee rate, (ii) minus estimated uncollected interest on charge-offs, (iii) plus estimated collected late fees. Applicable for loans originated after July 2009.",INSTITUTIONAL and FINANCIAL
D15,EstimatedLoss,Estimated loss is the estimated principal loss on charge-offs. Applicable for loans originated after July 2009.,INSTITUTIONAL and FINANCIAL
D15,EstimatedReturn,The estimated return assigned to the listing at the time it was created. Estimated return is the difference between the Estimated Effective Yield and the Estimated Loss Rate. Applicable for loans originated after July 2009.,INSTITUTIONAL and FINANCIAL
D15,ProsperRating (numeric),"The Prosper Rating assigned at the time the listing was created: 0 - N/A, 1 - HR, 2 - E, 3 - D, 4 - C, 5 - B, 6 - A, 7 - AA. Applicable for loans originated after July 2009.",INSTITUTIONAL and FINANCIAL
D15,ProsperRating (Alpha),The Prosper Rating assigned at the time the listing was created between AA - HR. Applicable for loans originated after July 2009.,INSTITUTIONAL and FINANCIAL
D15,ProsperScore,"A custom risk score built using historical Prosper data. The score ranges from 1-10, with 10 being the best, or lowest risk score. Applicable for loans originated after July 2009.",INSTITUTIONAL and FINANCIAL
D15,ListingCategory,"The category of the listing that the borrower selected when posting their listing: 0 - Not Available, 1 - Debt Consolidation, 2 - Home Improvement, 3 - Business, 4 - Personal Loan, 5 - Student Use, 6 - Auto, 7- Other, 8 - Baby&Adoption, 9 - Boat, 10 - Cosmetic Procedure, 11 - Engagement Ring, 12 - Green Loans, 13 - Household Expenses, 14 - Large Purchases, 15 - Medical/Dental, 16 - Motorcycle, 17 - RV, 18 - Taxes, 19 - Vacation, 20 - Wedding Loans","VALUES, ATTITUDES and BEHAVIORAL"
D15,BorrowerState,The two letter abbreviation of the state of the address of the borrower at the time the Listing was created.,ALTERNATIVE
D15,Occupation,The Occupation selected by the Borrower at the time they created the listing.,SOCIOECONOMIC
D15,EmploymentStatus,The employment status of the borrower at the time they posted the listing.,SOCIOECONOMIC
D15,EmploymentStatusDuration,The length in months of the employment status at the time the listing was created.,SOCIOECONOMIC
D15,IsBorrowerHomeowner,A Borrower will be classified as a homowner if they have a mortgage on their credit profile or provide documentation confirming they are a homeowner.,SOCIOECONOMIC
D15,CurrentlyInGroup,Specifies whether or not the Borrower was in a group at the time the listing was created.,ALTERNATIVE
D15,GroupKey,The Key of the group in which the Borrower is a member of. Value will be null if the borrower does not have a group affiliation.,OPERATIONAL
D15,DateCreditPulled,The date the credit profile was pulled.,OPERATIONAL
D15,CreditScoreRangeLower,The lower value representing the range of the borrower's credit score as provided by a consumer credit rating agency.,INSTITUTIONAL and FINANCIAL
D15,CreditScoreRangeUpper,The upper value representing the range of the borrower's credit score as provided by a consumer credit rating agency.,INSTITUTIONAL and FINANCIAL
D15,FirstRecordedCreditLine,The date the first credit line was opened.,OPERATIONAL
D15,CurrentCreditLines,Number of current credit lines at the time the credit profile was pulled.,INSTITUTIONAL and FINANCIAL
D15,OpenCreditLines,Number of open credit lines at the time the credit profile was pulled.,INSTITUTIONAL and FINANCIAL
D15,TotalCreditLinespast7years,Number of credit lines in the past seven years at the time the credit profile was pulled.,INSTITUTIONAL and FINANCIAL
D15,OpenRevolvingAccounts,Number of open revolving accounts at the time the credit profile was pulled.,INSTITUTIONAL and FINANCIAL
D15,OpenRevolvingMonthlyPayment,Monthly payment on revolving accounts at the time the credit profile was pulled.,INSTITUTIONAL and FINANCIAL
D15,InquiriesLast6Months,Number of inquiries in the past six months at the time the credit profile was pulled.,INSTITUTIONAL and FINANCIAL
D15,TotalInquiries,Total number of inquiries at the time the credit profile was pulled.,INSTITUTIONAL and FINANCIAL
D15,CurrentDelinquencies,Number of accounts delinquent at the time the credit profile was pulled.,INSTITUTIONAL and FINANCIAL
D15,AmountDelinquent,Dollars delinquent at the time the credit profile was pulled.,INSTITUTIONAL and FINANCIAL
D15,DelinquenciesLast7Years,Number of delinquencies in the past 7 years at the time the credit profile was pulled.,INSTITUTIONAL and FINANCIAL
D15,PublicRecordsLast10Years,Number of public records in the past 10 years at the time the credit profile was pulled.,INSTITUTIONAL and FINANCIAL
D15,PublicRecordsLast12Months,Number of public records in the past 12 months at the time the credit profile was pulled.,INSTITUTIONAL and FINANCIAL
D15,RevolvingCreditBalance,Dollars of revolving credit at the time the credit profile was pulled.,INSTITUTIONAL and FINANCIAL
D15,BankcardUtilization,The percentage of available revolving credit that is utilized at the time the credit profile was pulled.,INSTITUTIONAL and FINANCIAL
D15,AvailableBankcardCredit,The total available credit via bank card at the time the credit profile was pulled.,INSTITUTIONAL and FINANCIAL
D15,TotalTrades,Number of trade lines ever opened at the time the credit profile was pulled.,INSTITUTIONAL and FINANCIAL
D15,TradesNeverDelinquent,Number of trades that have never been delinquent at the time the credit profile was pulled.,INSTITUTIONAL and FINANCIAL
D15,TradesOpenedLast6Months,Number of trades opened in the last 6 months at the time the credit profile was pulled.,INSTITUTIONAL and FINANCIAL
D15,DebtToIncomeRatio,The debt to income ratio of the borrower at the time the credit profile was pulled. This value is Null if the debt to income ratio is not available. This value is capped at 10.01 (any debt to income ratio larger than 1000% will be returned as 1001%).,INSTITUTIONAL and FINANCIAL
D15,IncomeRange,The income range of the borrower at the time the listing was created.,SOCIOECONOMIC
D15,IncomeVerifiable,The borrower indicated they have the required documentation to support their income.,SOCIOECONOMIC
D15,StatedMonthlyIncome,The monthly income the borrower stated at the time the listing was created.,SOCIOECONOMIC
D15,LoanKey,Unique key for each loan. This is the same key that is used in the API.,OPERATIONAL
D15,TotalProsperLoans,Number of Prosper loans the borrower at the time they created this listing. This value will be null if the borrower had no prior loans.,INSTITUTIONAL and FINANCIAL
D15,TotalProsperPaymentsBilled,Number of on time payments the borrower made on Prosper loans at the time they created this listing. This value will be null if the borrower had no prior loans.,INSTITUTIONAL and FINANCIAL
D15,OnTimeProsperPayments,Number of on time payments the borrower had made on Prosper loans at the time they created this listing. This value will be null if the borrower has no prior loans.,INSTITUTIONAL and FINANCIAL
D15,ProsperPaymentsLessThanOneMonthLate,Number of payments the borrower made on Prosper loans that were less than one month late at the time they created this listing. This value will be null if the borrower had no prior loans.,INSTITUTIONAL and FINANCIAL
D15,ProsperPaymentsOneMonthPlusLate,Number of payments the borrower made on Prosper loans that were greater than one month late at the time they created this listing. This value will be null if the borrower had no prior loans.,INSTITUTIONAL and FINANCIAL
D15,ProsperPrincipalBorrowed,Total principal borrowed on Prosper loans at the time the listing was created. This value will be null if the borrower had no prior loans.,INSTITUTIONAL and FINANCIAL
D15,ProsperPrincipalOutstanding,Principal outstanding on Prosper loans at the time the listing was created. This value will be null if the borrower had no prior loans.,INSTITUTIONAL and FINANCIAL
D15,ScorexChangeAtTimeOfListing,Borrower's credit score change at the time the credit profile was pulled. This will be the change relative to the borrower's last Prosper loan. This value will be null if the borrower had no prior loans.,INSTITUTIONAL and FINANCIAL
D15,LoanCurrentDaysDelinquent,The number of days delinquent.,INSTITUTIONAL and FINANCIAL
D15,LoanFirstDefaultedCycleNumber,The cycle the loan was charged off. If the loan has not charged off the value will be null.,INSTITUTIONAL and FINANCIAL
D15,LoanMonthsSinceOrigination,Number of months since the loan originated.,INSTITUTIONAL and FINANCIAL
D15,LoanNumber,Unique numeric value associated with the loan.,OPERATIONAL
D15,LoanOriginalAmount,The origination amount of the loan.,INSTITUTIONAL and FINANCIAL
D15,LoanOriginationDate,The date the loan was originated.,OPERATIONAL
D15,LoanOriginationQuarter,The quarter in which the loan was originated.,OPERATIONAL
D15,MemberKey,The unique key that is associated with the borrower. This is the same identifier that is used in the API member object.,OPERATIONAL
D15,MonthlyLoanPayment,The scheduled monthly loan payment.,INSTITUTIONAL and FINANCIAL
D15,LP_CustomerPayments,"Pre charge-off cumulative gross payments made by the borrower on the loan. If the loan has charged off, this value will exclude any recoveries.",INSTITUTIONAL and FINANCIAL
D15,LP_CustomerPrincipalPayments,"Pre charge-off cumulative principal payments made by the borrower on the loan. If the loan has charged off, this value will exclude any recoveries.",INSTITUTIONAL and FINANCIAL
D15,LP_InterestandFees,"Pre charge-off cumulative interest and fees paid by the borrower. If the loan has charged off, this value will exclude any recoveries.",INSTITUTIONAL and FINANCIAL
D15,LP_ServiceFees,Cumulative service fees paid by the investors who have invested in the loan.,INSTITUTIONAL and FINANCIAL
D15,LP_CollectionFees,Cumulative collection fees paid by the investors who have invested in the loan.,INSTITUTIONAL and FINANCIAL
D15,LP_GrossPrincipalLoss,The gross charged off amount of the loan.,INSTITUTIONAL and FINANCIAL
D15,LP_NetPrincipalLoss,The principal that remains uncollected after any recoveries.,INSTITUTIONAL and FINANCIAL
D15,LP_NonPrincipalRecoverypayments,"The interest and fee component of any recovery payments. The current payment policy applies payments in the following order: Fees, interest, principal.",INSTITUTIONAL and FINANCIAL
D15,PercentFunded,Percent the listing was funded.,INSTITUTIONAL and FINANCIAL
D15,Recommendations,Number of recommendations the borrower had at the time the listing was created.,ALTERNATIVE
D15,InvestmentFromFriendsCount,Number of friends that made an investment in the loan.,ALTERNATIVE
D15,InvestmentFromFriendsAmount,Dollar amount of investments that were made by friends.,ALTERNATIVE
D15,Investors,The number of investors that funded the loan.,INSTITUTIONAL and FINANCIAL
